{
  "schema_version": "1.0.0",
  "catalog_id": "terraflux-input-acquisition-catalog",
  "purpose": "Definir como cada fato ou regra externa e obtido, validado, atualizado e bloqueado antes de alimentar os motores de sistematizacao.",
  "evidence_packages": [
    {
      "id": "SCOPE_BOUNDARY_PERMISSION",
      "title": "Escopo, limites e permissoes fundiarias",
      "domain": "SCOPE",
      "purpose": "Identificar talhoes e imoveis e controlar continuidade entre unidades sem presumir direito de acesso ou trabalho.",
      "primary_parameter_ids": ["scope.target_field_ids", "scope.target_property_ids", "scope.allow_cross_field_work", "scope.allow_cross_property_work", "scope.cross_property_permission_status"],
      "supporting_parameter_ids": [],
      "required_for": {"delivery_levels": ["E0_TRIAGEM", "E1_OPERACIONAL", "E2_CONSERVACIONISTA", "E3_EXECUTIVO"], "scenarios": ["CF0_GEOMETRY", "C1_CURVA_EMBUTIDA", "C2_BASE_LARGA_PASSANTE", "C3_ESD", "POA_LOGISTICS"], "gates": ["SCOPE_IDENTIFIED", "CROSS_PROPERTY_AUTHORIZED"]},
      "acquisition_modes": [
        {"mode": "CLIENT_UPLOAD", "priority": 1, "authority": "Proprietario ou gestor autorizado", "source_ref": "CLIENT:FIELD_AND_PROPERTY_REGISTER", "method": "Enviar limites operacionais e identificadores, declarar o escopo e anexar permissoes por geometria e acao.", "can_prefill": true, "can_release": true, "limitations": "Um poligono desenhado nao comprova dominio nem permissao."},
        {"mode": "OFFICIAL_DATA", "priority": 2, "authority": "INCRA SIGEF, SICAR e Meu Imovel Rural", "source_ref": "https://www.gov.br/gestao/pt-br/assuntos/meu-imovel-rural/como-funciona-1/visualizar-dados-e-baixar-documentos-de-imoveis-rurais/", "method": "Importar geometrias oficiais ou declaratorias para reconciliacao com o limite operacional.", "can_prefill": true, "can_release": false, "limitations": "CAR e contexto ambiental; SIGEF certifica georreferenciamento, mas a permissao operacional continua especifica."}
      ],
      "data_contract": {"accepted_formats": ["GPKG", "SHP", "GEOJSON", "KML", "JSON", "PDF"], "geometry_types": ["Polygon", "MultiPolygon", "LineString", "Point"], "required_fields": [{"name": "feature_id", "type": "string", "unit": null, "required": true}, {"name": "property_id", "type": "string", "unit": null, "required": true}, {"name": "permission_status", "type": "enum", "unit": null, "required": true}, {"name": "allowed_actions", "type": "array", "unit": null, "required": true}, {"name": "valid_to", "type": "date", "unit": null, "required": false}], "required_metadata": ["source_kind", "captured_at", "crs", "responsible", "reviewer", "revision", "hash", "applicability_geometry"]},
      "field_protocol": ["Conciliar limite operacional, cadastral e ambiental sem fundi-los silenciosamente.", "Vistoriar cercas, divisas, porteiras e acessos usados por qualquer continuidade."],
      "qa_requirements": ["Todo field_id deve estar contido no escopo declarado.", "Permissao deve indicar geometria, acao, autoridade, vigencia e documento; ausencia fecha a conexao."],
      "freshness": {"policy": "PER_PROJECT", "max_age_days": null, "refresh_triggers": ["mudanca de arrendamento", "retificacao de limite", "novo acesso ou obra"]},
      "owner_roles": ["CLIENT", "SURVEY", "LEGAL_REVIEW"],
      "absence_policy": "SCREENING_ONLY",
      "blocker_codes": ["PROPERTY_IDENTITY_UNCONFIRMED", "CROSS_PROPERTY_PERMISSION_MISSING"]
    },
    {
      "id": "SURVEY_VERTICAL",
      "title": "Controle geodesico, vertical e incerteza",
      "domain": "TERRAIN",
      "purpose": "Provar referencia vertical e acuracia absoluta compatíveis com as menores quedas decisorias.",
      "primary_parameter_ids": ["terrain.horizontal_crs", "terrain.vertical_reference", "terrain.vertical_accuracy_m", "terrain.survey_evidence_ref", "terrain.checkpoint_set_ref"],
      "supporting_parameter_ids": ["terrain.terrain_uncertainty_ref", "qa.uncertainty_set_ref"],
      "required_for": {"delivery_levels": ["E1_OPERACIONAL", "E2_CONSERVACIONISTA", "E3_EXECUTIVO"], "scenarios": ["C1_CURVA_EMBUTIDA", "C2_BASE_LARGA_PASSANTE", "C3_ESD", "GUIDANCE_EXPORT"], "gates": ["MDT_ABSOLUTE_ACCURACY", "VERTICAL_DECISION_MARGIN"]},
      "acquisition_modes": [
        {"mode": "FIELD_SURVEY", "priority": 1, "authority": "Responsavel pelo levantamento", "source_ref": "IBGE:SGB_AND_PROJECT_SURVEY", "method": "Ligar o levantamento ao SGB, declarar datum/modelo geoidal e medir checkpoints independentes dos GCPs distribuidos por area, forma e relevo.", "can_prefill": false, "can_release": true, "limitations": "A quantidade de checkpoints depende do projeto; uma politica internacional de 30 nao e norma agronomica brasileira."},
        {"mode": "OFFICIAL_DATA", "priority": 2, "authority": "IBGE", "source_ref": "https://www.ibge.gov.br/geociencias/modelos-digitais-de-superficie/modelos-digitais-de-superficie/31283-hgeohnor2020-modeloconversaoaltitudesgeometricasgnss-datumverticalsgb.html", "method": "Registrar versao do hgeoHNOR e transformacao entre altitude geometrica e REALT2018.", "can_prefill": true, "can_release": false, "limitations": "O modelo de conversao nao substitui pontos de controle independentes no terreno."}
      ],
      "data_contract": {"accepted_formats": ["GPKG", "CSV", "JSON", "LAS", "LAZ", "TIF", "PDF"], "geometry_types": ["Point", "Raster"], "required_fields": [{"name": "checkpoint_id", "type": "string", "unit": null, "required": true}, {"name": "x", "type": "number", "unit": "m", "required": true}, {"name": "y", "type": "number", "unit": "m", "required": true}, {"name": "z_reference", "type": "number", "unit": "m", "required": true}, {"name": "z_surface", "type": "number", "unit": "m", "required": true}, {"name": "residual_z", "type": "number", "unit": "m", "required": true}], "required_metadata": ["crs", "vertical_ref", "geoid_model_version", "method_ref", "uncertainty", "captured_at", "responsible", "reviewer", "revision", "hash"]},
      "field_protocol": ["Separar checkpoints de apoios usados no ajuste.", "Distribuir pontos por relevo, cobertura, bordas e faixa de elevacao.", "Gerar residuos, RMSE, P95, maximo, bias e superficie de incerteza."],
      "qa_requirements": ["Comparacao entre dois MDTs da mesma fonte nao e acuracia absoluta.", "Cada gate de greide ou queda deve permanecer estavel dentro da incerteza local."],
      "freshness": {"policy": "PER_PROJECT", "max_age_days": null, "refresh_triggers": ["terraplenagem", "erosao relevante", "mudanca de datum ou processamento"]},
      "owner_roles": ["SURVEY", "QA_ENGINEER"],
      "absence_policy": "BLOCK_E2",
      "blocker_codes": ["VERTICAL_DATUM_UNKNOWN", "INDEPENDENT_CHECKPOINTS_MISSING", "DTM_UNCERTAINTY_UNRESOLVED"]
    },
    {
      "id": "TERRAIN_SURFACE_CONTEXT",
      "title": "Superficie, breaklines e contexto topografico",
      "domain": "TERRAIN",
      "purpose": "Construir MDT de solo auditavel e representar feicoes que controlam o caminho superficial da agua.",
      "primary_parameter_ids": ["terrain.dtm_dataset_ref", "terrain.analysis_envelope_ref", "terrain.breakline_inventory_ref"],
      "supporting_parameter_ids": ["terrain.coverage_status", "terrain.slope_raster_ref", "terrain.hydrologic_conditioning_status"],
      "required_for": {"delivery_levels": ["E0_TRIAGEM", "E1_OPERACIONAL", "E2_CONSERVACIONISTA", "E3_EXECUTIVO"], "scenarios": ["CF0_GEOMETRY", "C1_CURVA_EMBUTIDA", "C2_BASE_LARGA_PASSANTE", "C3_ESD", "POA_LOGISTICS"], "gates": ["DTM_FULL_COVERAGE", "TERRAIN_FEATURES_REVIEWED"]},
      "acquisition_modes": [
        {"mode": "CLIENT_UPLOAD", "priority": 1, "authority": "Cliente ou empresa de aerolevantamento", "source_ref": "CLIENT:LAZ_LAS_DTM_ORTHOMOSAIC", "method": "Enviar nuvem, MDT, ortomosaico, relatorio do voo e classificacao original; preservar dados nao solo para revisar feicoes.", "can_prefill": true, "can_release": false, "limitations": "Nuvem somente classe 2 nao comprova ausencia de postes, arvores, edificios ou canais."},
        {"mode": "FIELD_SURVEY", "priority": 2, "authority": "Equipe topografica", "source_ref": "FIELD:BREAKLINE_AND_GAP_SURVEY", "method": "Completar vazios e levantar cristas, fundos, estradas, valas, taludes, bueiros e saidas em 3D.", "can_prefill": false, "can_release": true, "limitations": "O envelope deve cobrir a area de decisao, nao apenas o poligono cultivado."}
      ],
      "data_contract": {"accepted_formats": ["LAS", "LAZ", "TIF", "COPC", "GPKG", "SHP", "GEOJSON", "JSON"], "geometry_types": ["Raster", "PointCloud", "LineString", "Polygon"], "required_fields": [{"name": "feature_id", "type": "string", "unit": null, "required": false}, {"name": "feature_type", "type": "enum", "unit": null, "required": false}, {"name": "elevation", "type": "number", "unit": "m", "required": false}], "required_metadata": ["crs", "vertical_ref", "resolution", "classification", "capture_method", "captured_at", "responsible", "revision", "hash", "qa_status"]},
      "field_protocol": ["Auditar classificacao, densidade, vazios, bordas e cobertura externa.", "Condicionar uma copia do MDT; nunca apagar a superficie observada.", "Revisar manualmente todas as feicoes condicionantes."],
      "qa_requirements": ["Cem por cento do envelope util deve cair sobre celulas finitas.", "Breaklines e condicionamentos devem ter proveniencia e diferenca rastreavel para o MDT original."],
      "freshness": {"policy": "PER_PROJECT", "max_age_days": null, "refresh_triggers": ["movimento de terra", "novo carreador", "erosao ou manutencao estrutural"]},
      "owner_roles": ["SURVEY", "GIS_ENGINEER", "HYDRAULIC_REVIEW"],
      "absence_policy": "SCREENING_ONLY",
      "blocker_codes": ["DTM_MISSING", "TERRAIN_CONTEXT_INCOMPLETE", "BREAKLINES_NOT_REVIEWED"]
    },
    {
      "id": "AGRONOMIC_CONFIGURATION",
      "title": "Configuracao agronomica e padrao de linhas",
      "domain": "SOIL",